{
  "pack_schema_version": "1.0.0",
  "pack_version": "1.0.0",
  "source": {
    "repo": "aegis-systemsv1/app-store-compliance",
    "commit": "3f686a5927646081becd18641116718a80c94b81",
    "tag": null,
    "exported_at": "2026-10-02T07:03:26.312212Z",
    "exported_by": "johngavin",
    "license": "OpenRoots Agent License 2.3",
    "license_origin": "Derived from app-store-compliance by Mirza Iqbal (mjmirza); this fork: aegis-systemsv1/app-store-compliance"
  },
  "requirements": [
    {
      "requirement_id": "AU-PRIVACY-APP1-001",
      "jurisdiction": "AU",
      "regulator": "OAIC",
      "legislation": {
        "title": "Privacy Act 1988 (Cth), Schedule 1, Australian Privacy Principle 1 (open and transparent management of personal information)",
        "amending_act": null,
        "source_url": "https://www.legislation.gov.au/C2004A03712/latest",
        "secondary_source_url": "https://www.oaic.gov.au/privacy/australian-privacy-principles/australian-privacy-principles-guidelines/chapter-1-app-1-open-and-transparent-management-of-personal-information",
        "source_retrieved_date": "2026-10-02"
      },
      "description": "An APP entity must manage personal information in an open and transparent way, including maintaining a clearly expressed and up-to-date privacy policy describing what personal information it collects and holds, how, why, and what happens to it, and how an individual can access, correct, or complain about its handling.",
      "status": "CURRENT_LAW",
      "effective_date": null,
      "applicability_conditions": [
        "application collects, holds, uses, or discloses personal information about individuals"
      ],
      "evidence_method": "HYBRID",
      "evidence_requirements": [
        {
          "evidence_id": "privacy-policy-present",
          "description": "A privacy policy document is present and discoverable (in the committed repository, or on a registered web target).",
          "method": "AUTOMATED",
          "note": "Presence/discoverability only, not a legal reading of adequacy.",
          "covers_catalogue_items": [
            "privacy_policy"
          ]
        },
        {
          "evidence_id": "privacy-policy-adequacy",
          "description": "The privacy policy accurately and completely describes the entity's actual personal-information practices.",
          "method": "OWNER_EVIDENCE",
          "note": "Adequacy and accuracy of content against real practice is a judgment call, not code-derivable.",
          "covers_catalogue_items": [
            "privacy_policy",
            "collection_notices"
          ]
        }
      ],
      "severity": "medium",
      "release_blocking_policy": "blocking_once_current_and_effective",
      "requirement_version": 1,
      "last_verified_date": "2026-10-02",
      "change_history": [
        {
          "requirement_version": 1,
          "changed_at": "2026-10-02",
          "change": "initial authoring",
          "pack_version_introduced": "1.0.0"
        }
      ]
    },
    {
      "requirement_id": "AU-PRIVACY-APP3-001",
      "jurisdiction": "AU",
      "regulator": "OAIC",
      "legislation": {
        "title": "Privacy Act 1988 (Cth), Schedule 1, Australian Privacy Principle 3 (collection of solicited personal information)",
        "amending_act": null,
        "source_url": "https://www.legislation.gov.au/C2004A03712/latest",
        "secondary_source_url": "https://www.oaic.gov.au/privacy/australian-privacy-principles/australian-privacy-principles-guidelines/chapter-3-app-3-collection-of-solicited-personal-information",
        "source_retrieved_date": "2026-10-02"
      },
      "description": "An APP entity must only collect personal information that is reasonably necessary for its functions or activities, and may only collect sensitive information (which includes health information) with the individual's consent or under a specific permitted exception. This covers what categories of personal information are collected, from what source, for what purpose, and whether collection is necessary.",
      "status": "CURRENT_LAW",
      "effective_date": null,
      "applicability_conditions": [
        "application collects any personal information directly or indirectly from individuals"
      ],
      "evidence_method": "HYBRID",
      "evidence_requirements": [
        {
          "evidence_id": "financial-data-signal",
          "description": "A payment-processing or financial-data dependency is present in the application's declared dependencies.",
          "method": "AUTOMATED",
          "note": "Presence of a payment SDK is a signal that financial information is likely collected, never a complete inventory.",
          "covers_catalogue_items": [
            "financial_information"
          ]
        },
        {
          "evidence_id": "location-data-signal",
          "description": "A geolocation or mapping dependency is present in the application's declared dependencies.",
          "method": "AUTOMATED",
          "note": "Presence signal only.",
          "covers_catalogue_items": [
            "location_information"
          ]
        },
        {
          "evidence_id": "device-behavioural-signal",
          "description": "An analytics or device-telemetry dependency is present (reuses the existing third-party/analytics detection).",
          "method": "AUTOMATED",
          "note": "Presence signal only.",
          "covers_catalogue_items": [
            "device_behavioural_information"
          ]
        },
        {
          "evidence_id": "personal-information-inventory",
          "description": "The actual categories of personal, sensitive, and health information collected by the application.",
          "method": "OWNER_EVIDENCE",
          "note": "Cannot be reliably enumerated from static code analysis alone.",
          "covers_catalogue_items": [
            "personal_information_collected",
            "sensitive_information",
            "health_information"
          ]
        },
        {
          "evidence_id": "generated-inferred-information",
          "description": "Whether the application generates or infers new personal information about an individual (e.g. a derived score or profile).",
          "method": "OWNER_EVIDENCE",
          "note": "A business-logic question, not visible from dependency or schema inspection alone.",
          "covers_catalogue_items": [
            "generated_inferred_personal_information"
          ]
        },
        {
          "evidence_id": "collection-source",
          "description": "Whether personal information is collected directly from the individual or from a third party.",
          "method": "OWNER_EVIDENCE",
          "covers_catalogue_items": [
            "collection_source"
          ]
        },
        {
          "evidence_id": "purpose-and-necessity",
          "description": "The stated purpose of collection and whether collection is reasonably necessary for that purpose.",
          "method": "OWNER_EVIDENCE",
          "note": "Inherently a judgment call about necessity, not a fact a scanner can establish.",
          "covers_catalogue_items": [
            "purpose_of_collection",
            "necessity_of_collection"
          ]
        },
        {
          "evidence_id": "sensitive-information-consent",
          "description": "Consent was obtained for collection of sensitive or health information, or a specific exception applies.",
          "method": "OWNER_EVIDENCE",
          "covers_catalogue_items": [
            "consent",
            "sensitive_information",
            "health_information"
          ]
        }
      ],
      "severity": "high",
      "release_blocking_policy": "blocking_once_current_and_effective",
      "requirement_version": 1,
      "last_verified_date": "2026-10-02",
      "change_history": [
        {
          "requirement_version": 1,
          "changed_at": "2026-10-02",
          "change": "initial authoring",
          "pack_version_introduced": "1.0.0"
        }
      ]
    },
    {
      "requirement_id": "AU-PRIVACY-APP5-001",
      "jurisdiction": "AU",
      "regulator": "OAIC",
      "legislation": {
        "title": "Privacy Act 1988 (Cth), Schedule 1, Australian Privacy Principle 5 (notification of the collection of personal information)",
        "amending_act": null,
        "source_url": "https://www.legislation.gov.au/C2004A03712/latest",
        "secondary_source_url": "https://www.oaic.gov.au/privacy/australian-privacy-principles/australian-privacy-principles-guidelines",
        "source_retrieved_date": "2026-10-02"
      },
      "description": "An APP entity must take reasonable steps to notify an individual, at or before the time of collection (or as soon as practicable after), of specified matters including what is collected, why, to whom it may be disclosed, and how the individual can access or complain about it.",
      "status": "CURRENT_LAW",
      "effective_date": null,
      "applicability_conditions": [
        "application collects personal information directly or indirectly from individuals"
      ],
      "evidence_method": "HYBRID",
      "evidence_requirements": [
        {
          "evidence_id": "collection-notice-present",
          "description": "A collection notice (standalone, or as a section of the privacy policy) is present and discoverable.",
          "method": "AUTOMATED",
          "covers_catalogue_items": [
            "collection_notices"
          ]
        },
        {
          "evidence_id": "collection-notice-content",
          "description": "The notice actually covers the matters APP 5 requires for this application's real collection practices.",
          "method": "OWNER_EVIDENCE",
          "covers_catalogue_items": [
            "collection_notices"
          ]
        }
      ],
      "severity": "medium",
      "release_blocking_policy": "blocking_once_current_and_effective",